{
  "schemaVersion": "events-v1",
  "runtimeId": "runtime-1",
  "eventId": "event-1",
  "sequence": 1,
  "work": { "workId": "issues:42", "kind": "issues", "issueNumber": 42 },
  "provider": { "name": "codex", "model": "gpt-test", "digest": "sha256:provider-model" },
  "digests": { "config": "sha256:config", "policy": "sha256:policy", "prompts": "sha256:prompts" },
  "startedAt": "2026-07-30T12:00:00.000Z",
  "endedAt": "2026-07-30T12:01:00.000Z",
  "outcome": "success",
  "failure": null,
  "verification": [
    { "command": "vp run ready", "status": "passed", "summary": "All checks passed." }
  ],
  "retries": 0,
  "escalations": 0,
  "resources": { "durationMs": 60000, "agentExitCode": 0, "summary": "1 commit" },
  "links": {
    "issue": "https://github.com/owner/repo/issues/42",
    "branch": "https://github.com/owner/repo/tree/phoebe%2Fissue-42"
  }
}
